Start Training on device: cuda

============================================================
Experimental Config: K-Fold=5, LR=0.005
============================================================

>>> Result Table (LR=0.005, K-Folds=5) <<<
Subject  Accuracy  Kappa  Macro_F1
     S1    0.8048 0.7560    0.8038
     S2    0.7086 0.6357    0.7074
     S3    0.8200 0.7750    0.8190
     S4    0.8086 0.7607    0.8067
     S5    0.7962 0.7452    0.7943
     S6    0.6486 0.5607    0.6468
     S7    0.7743 0.7179    0.7694
     S8    0.7610 0.7012    0.7610
     S9    0.6762 0.5952    0.6737
    S10    0.8076 0.7595    0.8083
    S11    0.6733 0.5917    0.6749
    S12    0.6286 0.5357    0.6203
    S13    0.6400 0.5500    0.6380
    S14    0.6286 0.5357    0.6252
    S15    0.7438 0.6798    0.7401
   Mean    0.7280 0.6600    0.7259

============================================================
Experimental Config: K-Fold=6, LR=0.005
============================================================

>>> Result Table (LR=0.005, K-Folds=6) <<<
Subject  Accuracy  Kappa  Macro_F1
     S1    0.7952 0.7440    0.7922
     S2    0.7103 0.6379    0.7107
     S3    0.8198 0.7748    0.8183
     S4    0.8016 0.7520    0.7991
     S5    0.8056 0.7569    0.8039
     S6    0.6889 0.6111    0.6890
     S7    0.7746 0.7183    0.7711
     S8    0.7540 0.6925    0.7544
     S9    0.6754 0.5942    0.6742
    S10    0.7698 0.7123    0.7670
    S11    0.6833 0.6042    0.6859
    S12    0.6643 0.5804    0.6549
    S13    0.6206 0.5258    0.6176
    S14    0.6595 0.5744    0.6575
    S15    0.7714 0.7143    0.7667
   Mean    0.7330 0.6662    0.7308

============================================================
Experimental Config: K-Fold=7, LR=0.005
============================================================

>>> Result Table (LR=0.005, K-Folds=7) <<<
Subject  Accuracy  Kappa  Macro_F1
     S1    0.8007 0.7509    0.7976
     S2    0.7034 0.6293    0.7022
     S3    0.8224 0.7781    0.8214
     S4    0.8184 0.7730    0.8165
     S5    0.7912 0.7389    0.7902
     S6    0.6973 0.6216    0.6968
     S7    0.7816 0.7270    0.7772
     S8    0.7585 0.6981    0.7573
     S9    0.6946 0.6182    0.6948
    S10    0.8293 0.7866    0.8291
    S11    0.6810 0.6012    0.6848
    S12    0.6374 0.5468    0.6269
    S13    0.6619 0.5774    0.6606
    S14    0.6673 0.5842    0.6647
    S15    0.7612 0.7015    0.7566
   Mean    0.7404 0.6755    0.7384

============================================================
Experimental Config: K-Fold=8, LR=0.005
============================================================

>>> Result Table (LR=0.005, K-Folds=8) <<<
Subject  Accuracy  Kappa  Macro_F1
     S1    0.8185 0.7731    0.8166
     S2    0.7155 0.6443    0.7125
     S3    0.8202 0.7753    0.8192
     S4    0.8143 0.7679    0.8122
     S5    0.8101 0.7626    0.8092
     S6    0.6833 0.6042    0.6821
     S7    0.7732 0.7165    0.7667
     S8    0.7661 0.7076    0.7657
     S9    0.6911 0.6138    0.6890
    S10    0.8071 0.7589    0.8066
    S11    0.6786 0.5982    0.6821
    S12    0.6315 0.5394    0.6201
    S13    0.6512 0.5640    0.6496
    S14    0.6494 0.5618    0.6468
    S15    0.7589 0.6987    0.7570
   Mean    0.7379 0.6724    0.7357

============================================================
Experimental Config: K-Fold=9, LR=0.005
============================================================

>>> Result Table (LR=0.005, K-Folds=9) <<<
Subject  Accuracy  Kappa  Macro_F1
     S1    0.8132 0.7665    0.8097
     S2    0.7153 0.6442    0.7143
     S3    0.8344 0.7930    0.8328
     S4    0.8074 0.7593    0.8057
     S5    0.8026 0.7533    0.8018
     S6    0.6905 0.6131    0.6881
     S7    0.7841 0.7302    0.7787
     S8    0.7688 0.7110    0.7688
     S9    0.6825 0.6032    0.6823
    S10    0.8148 0.7685    0.8148
    S11    0.6825 0.6032    0.6856
    S12    0.6635 0.5794    0.6571
    S13    0.6466 0.5582    0.6440
    S14    0.6476 0.5595    0.6444
    S15    0.7730 0.7163    0.7699
   Mean    0.7418 0.6772    0.7399

============================================================
Experimental Config: K-Fold=10, LR=0.005
============================================================

>>> Result Table (LR=0.005, K-Folds=10) <<<
Subject  Accuracy  Kappa  Macro_F1
     S1    0.8200 0.7750    0.8177
     S2    0.6857 0.6071    0.6837
     S3    0.8233 0.7792    0.8219
     S4    0.8162 0.7702    0.8147
     S5    0.7971 0.7464    0.7960
     S6    0.6943 0.6179    0.6910
     S7    0.7810 0.7262    0.7752
     S8    0.7690 0.7113    0.7690
     S9    0.6895 0.6119    0.6898
    S10    0.8000 0.7500    0.7984
    S11    0.6833 0.6042    0.6857
    S12    0.6414 0.5518    0.6320
    S13    0.6448 0.5560    0.6440
    S14    0.6576 0.5720    0.6539
    S15    0.7614 0.7018    0.7590
   Mean    0.7377 0.6721    0.7355

############################################################
Hyperparameter Search Summary
############################################################
    LR  K_Folds  Mean_Acc  Mean_Kappa  Mean_F1
0.0050        5    0.7280      0.6600   0.7259
0.0050        6    0.7330      0.6662   0.7308
0.0050        7    0.7404      0.6755   0.7384
0.0050        8    0.7379      0.6724   0.7357
0.0050        9    0.7418      0.6772   0.7399
0.0050       10    0.7377      0.6721   0.7355

最佳配置: LR = 0.005, K-Folds = 9.0
最佳精度: 0.7418, Kappa: 0.6772
